{
  "account": "dev",
  "topic": "Mods de Claude Code",
  "infoDate": "2026-10-16",
  "idea": "En este carrusel, el camino que recorre cada evento dentro de Claude Code se vuelve una línea que cruza todas las láminas, y cada parada muestra dónde se mete un mod: antes, en lugar de y después.",
  "art": {
    "direction": "linea-continua",
    "dealt": [
      "captura-anotada",
      "linea-continua",
      "titular-gigante"
    ],
    "reason": "El tema es un camino: cada evento de Claude Code pasa por un punto donde un mod actúa antes, en lugar de o después. La línea que cruza las láminas es ese camino y cada lámina es una parada. La captura anotada y la terminal entran como préstamos en las láminas de /diff y de cómo empezar.",
    "borrowed": [
      "captura-anotada",
      "terminal"
    ],
    "palette": {
      "bg": "#F4EEE4",
      "ink": "#17120E",
      "accent": "#B4532F",
      "accentInk": "#F4EEE4",
      "surface": "#EAE1D3"
    },
    "fonts": {
      "display": "bricolage",
      "text": "geist"
    },
    "anchor": {
      "kind": "logo",
      "ref": "claudecode",
      "source": "Ícono oficial de Claude Code en Simple Icons (CC0), tomado de code.claude.com; se usa sin modificar para identificar el tema"
    }
  },
  "caption": "/diff ya no viene de fábrica en Claude Code. Ahora es un mod, y tú puedes escribir el tuyo.\n\nAnthropic anunció los mods el 1 de octubre de 2026. Un mod es una función de TypeScript que se mete en un evento (una llamada a herramienta, una solicitud de permiso o un cambio en pantalla) y corre antes, después o en lugar de él.\n\nLo que ya puedes hacer con uno:\n1. Reescribir tu prompt antes de que lo lea el modelo.\n2. Bloquear, reescribir o reintentar llamadas a herramientas.\n3. Aprobar o negar permisos.\n4. Ocultar secretos en la salida.\n5. Agregar botones y paneles.\n6. Reemplazar funciones nativas, como /diff.\n\nEn equipo: mostrar el estado del CI/CD en un panel, pedir confirmación antes de tocar producción o registrar cada llamada a herramienta.\n\nOjo: no corren aislados. Tienen el mismo acceso a tu máquina que Claude Code, así que instala solo los de fuentes confiables.\n\n¿Cuál sería tu primer mod? Guárdalo para cuando lo escribas.\n\nInfo al 16 de octubre de 2026. Fuente: blog oficial de Claude.\n\n#claudecode #ia #programacion #desarrolladores #anthropic",
  "slideCaptions": [
    "Claude Code ya se puede reprogramar: los mods llegaron el 1 de octubre de 2026.",
    "Un mod es una función de TypeScript que se engancha a un evento de Claude Code.",
    "Antes del evento, un mod puede reescribir tu prompt, frenar una herramienta o decidir un permiso.",
    "En lugar del evento: /diff ya es un mod que puedes desactivar o reemplazar.",
    "Después del evento, un mod puede ocultar secretos en la salida o registrar cada llamada a herramienta.",
    "Para empezar: /plugin en la CLI o pídele a Claude Code que escriba el mod.",
    "Ojo: los mods no corren aislados. Instala solo los de fuentes confiables.",
    "¿Cuál sería tu primer mod? Guárdalo para cuando lo escribas."
  ],
  "sources": [
    {
      "title": "Customize Claude Code with mods (blog de Claude, 1 de octubre de 2026)",
      "url": "https://claude.com/blog/claude-code-mods",
      "checkedAt": "2026-10-16"
    },
    {
      "title": "Personaliza Claude Code con mods (artículo en español, captura del 16 de octubre de 2026)",
      "url": "https://claude.com/es/resources/articles/claude-code-mods",
      "checkedAt": "2026-10-16"
    }
  ]
}
