{
  "account": "dev",
  "topic": "Gemini 4 Argon",
  "infoDate": "2026-10-16",
  "idea": "En este carrusel, la llamada a la API de gemini-4-argon se vuelve una terminal continua donde probamos cada nueva capacidad: razonamiento por niveles, salida de 1M de tokens y precios.",
  "art": {
    "direction": "terminal",
    "dealt": [
      "elige-tu-camino",
      "collage",
      "terminal"
    ],
    "reason": "El tema es un modelo para desarrolladores que se consume por API y CLI. La dirección terminal permite mostrar el JSON real de la petición, las llamadas con curl y los parámetros exactos sin inventar interfaces.",
    "borrowed": [
      "ficha-tecnica"
    ],
    "palette": {
      "bg": "#0D0C14",
      "ink": "#F3F1F8",
      "accent": "#8E75B2",
      "accentInk": "#FFFFFF",
      "surface": "#1A1726"
    },
    "fonts": {
      "display": "geist",
      "text": "geist"
    },
    "anchor": {
      "kind": "logo",
      "ref": "googlegemini",
      "source": "Ícono oficial de Google Gemini en Simple Icons (#8E75B2)"
    }
  },
  "caption": "Google acaba de lanzar Gemini 4 Argon ('gemini-4-argon'), su nuevo modelo insignia enfocado en razonamiento profundo para desarrolladores.\n\nLo que cambia en la práctica:\n1. 1 millón de tokens de salida: no solo lee repositorios enteros, ahora puede emitir hasta 1M de tokens en una sola llamada continua.\n2. Nivel de pensamiento configurable: puedes ajustar el parámetro 'thinkingLevel' en 'low', 'medium' o 'high' según el costo y la dificultad de la tarea.\n3. #1 en el Vals Index: evaluación independiente en tareas reales de ingeniería de software, ciberseguridad, finanzas e impuestos.\n4. Precios de lanzamiento: $2.00 / 1M tokens de entrada y $10.00 / 1M de salida (hasta el 30 de noviembre de 2026), con 95% de descuento en context caching.\n\nYa está disponible en Google AI Studio, Vertex AI y Google Antigravity.\n\n¿Ya lo probaste en tu flujo de desarrollo? Guarda este post para configurar tu primera llamada.\n\nInfo al 16 de octubre de 2026. Fuentes: Google Blog y documentación oficial de Gemini API.\n\n#gemini #googleai #desarrolladores #programacion #ia #softwareengineering",
  "slideCaptions": [
    "Google presenta Gemini 4 Argon: su nuevo modelo de razonamiento para código y tareas complejas.",
    "Parámetro thinkingLevel: 3 niveles de razonamiento configurables para optimizar latencia y costo.",
    "Ventana unificada de 1M de tokens: entrada masiva y hasta 1 millón de tokens de respuesta.",
    "Tarifas introductorias de lanzamiento y 95% de ahorro con almacenamiento en caché de contexto.",
    "#1 en el benchmark Vals Index para ingeniería de software y blindaje contra inyección indirecta de prompts.",
    "Disponible desde hoy en Google AI Studio, Vertex AI y Google Antigravity."
  ],
  "sources": [
    {
      "title": "Google announces Gemini 4 Argon (Google Blog, octubre de 2026)",
      "url": "https://blog.google/technology/ai/gemini-4-argon",
      "checkedAt": "2026-10-16"
    },
    {
      "title": "Gemini 4 Argon Model Guide and Pricing (Google AI Documentation)",
      "url": "https://ai.google.dev/gemini-api/docs/models/gemini-4-argon",
      "checkedAt": "2026-10-16"
    }
  ]
}
